{
  "schema_version": "1.0.0",
  "authorization_id": "ca.sco.segment.500_plus.property_type_semantic_execution",
  "authorization_version": "1.0.0",
  "approved_on": "2026-09-15",
  "owner_instruction": "autorizzo",
  "gate": "HUMAN_PROPERTY_TYPE_SEMANTIC_EXECUTION_REVIEW",
  "canonical_base_sha": "c3f0dc7e374d21283358e4e1e8d403f078f08acb",
  "execution_approval_ref": "OWNER_CHAT_APPROVAL_2026-09-15_PROPERTY_TYPE_SEMANTIC_EXECUTION_BOUNDED",
  "privacy_approval_ref": "OWNER_CHAT_APPROVAL_2026-09-15_PROPERTY_TYPE_TRANSIENT_ROW_PRIVACY_BOUNDED",
  "authorized_scope": {
    "bounded_semantic_execution": true,
    "transient_row_privacy_exposure": true,
    "network_one_shot_workflow": true,
    "source_approval": false,
    "registry_activation": false,
    "identity_resolution": false,
    "beneficiary_matching": false,
    "outreach": false
  },
  "privacy_controls": {
    "memory_only": true,
    "transient_buffer_retention_days": 0,
    "immediate_disposal": true,
    "raw_body_persistence": false,
    "full_row_persistence": false,
    "property_id_persistence": false,
    "owner_holder_persistence": false,
    "per_row_property_type_persistence": false,
    "record_values_in_logs": false
  },
  "execution_caps": {
    "members": 4,
    "rows_max_per_member": 4,
    "rows_max_total": 16,
    "head_requests_max": 1,
    "range_requests_max": 4,
    "http_requests_max_total": 5,
    "range_response_bytes_max_each": 131072,
    "source_response_body_bytes_max_total": 524288,
    "uncompressed_transient_bytes_max_each": 262144,
    "uncompressed_transient_bytes_max_total": 1048576,
    "logical_record_bytes_max": 32768,
    "additional_range_allowed": false,
    "full_body_fallback_allowed": false
  },
  "workflow_path": ".github/workflows/ca-sco-property-type-semantic-verification-once.yml",
  "next_gate": "HUMAN_PROPERTY_TYPE_SEMANTIC_EXECUTION_EVIDENCE_REVIEW"
}
